{
  "schemaVersion": "1.0",
  "contentVersion": "2026.07.2",
  "source": {
    "name": "ai-interview-reviewed-catalog",
    "locator": "classpath:capability-content/catalog-v1.json"
  },
  "effectiveDate": "2026-07-15",
  "checksum": "sha256:f473b361c99b0912921450cbecb3140b60298d457e6d93c8bd8fe4d3e70e8cd4",
  "atoms": [
    {
      "atomId": "JAVA_LANGUAGE_FOUNDATION",
      "version": "1.0.0",
      "name": "Java 语言与并发基础",
      "description": "JVM 语义、集合、并发原语、线程模型与 Java 21 实践",
      "capabilityDomain": "LANGUAGE",
      "jobTracks": ["JAVA_BACKEND"],
      "parentAtomId": null
    },
    {
      "atomId": "SPRING_APPLICATION",
      "version": "1.0.0",
      "name": "Spring 应用开发",
      "description": "IoC、AOP、事务、MVC 以及 Spring Boot 工程实践",
      "capabilityDomain": "FRAMEWORK",
      "jobTracks": ["JAVA_BACKEND"],
      "parentAtomId": null
    },
    {
      "atomId": "DATABASE_TRANSACTION",
      "version": "1.0.0",
      "name": "数据库与事务",
      "description": "索引、执行计划、隔离级别、锁与一致性设计",
      "capabilityDomain": "DATA",
      "jobTracks": ["JAVA_BACKEND"],
      "parentAtomId": null
    },
    {
      "atomId": "CACHE_DISTRIBUTED",
      "version": "1.0.0",
      "name": "缓存与分布式协调",
      "description": "Redis 数据结构、缓存一致性、分布式锁与故障降级",
      "capabilityDomain": "DISTRIBUTED_SYSTEM",
      "jobTracks": ["JAVA_BACKEND"],
      "parentAtomId": null
    },
    {
      "atomId": "MESSAGE_RELIABILITY",
      "version": "1.0.0",
      "name": "消息可靠性",
      "description": "RabbitMQ 投递语义、幂等消费、重试与死信治理",
      "capabilityDomain": "MIDDLEWARE",
      "jobTracks": ["JAVA_BACKEND", "AI_RAG_AGENT"],
      "parentAtomId": null
    },
    {
      "atomId": "BACKEND_SYSTEM_DESIGN",
      "version": "1.0.0",
      "name": "后端系统设计",
      "description": "从约束出发完成接口、数据、可靠性与可观测性设计",
      "capabilityDomain": "SYSTEM_DESIGN",
      "jobTracks": ["JAVA_BACKEND", "AI_RAG_AGENT"],
      "parentAtomId": null
    },
    {
      "atomId": "PROJECT_TROUBLESHOOTING",
      "version": "1.0.0",
      "name": "项目深挖与故障定位",
      "description": "结合真实调用链解释取舍、边界、故障证据与修复过程",
      "capabilityDomain": "PROJECT",
      "jobTracks": ["JAVA_BACKEND", "AI_RAG_AGENT"],
      "parentAtomId": null
    },
    {
      "atomId": "RAG_DOCUMENT_PIPELINE",
      "version": "1.0.0",
      "name": "RAG 文档处理链路",
      "description": "解析、切块、父子上下文、向量化状态与一致性",
      "capabilityDomain": "RAG",
      "jobTracks": ["AI_RAG_AGENT"],
      "parentAtomId": null
    },
    {
      "atomId": "RAG_RETRIEVAL",
      "version": "1.0.0",
      "name": "检索与证据编排",
      "description": "混合检索、RRF、Rerank、Query Decomposition、CRAG 与证据边界",
      "capabilityDomain": "RAG",
      "jobTracks": ["AI_RAG_AGENT"],
      "parentAtomId": null
    },
    {
      "atomId": "RAG_EVALUATION",
      "version": "1.0.0",
      "name": "RAG 评测",
      "description": "检索指标、RAGAS、坏例集、版本对比与可复现评估",
      "capabilityDomain": "EVALUATION",
      "jobTracks": ["AI_RAG_AGENT"],
      "parentAtomId": null
    },
    {
      "atomId": "AGENT_ORCHESTRATION",
      "version": "1.0.0",
      "name": "Agent 编排",
      "description": "显式状态机、Plan-and-Execute、Reflection、工具权限与恢复",
      "capabilityDomain": "AGENT",
      "jobTracks": ["AI_RAG_AGENT"],
      "parentAtomId": null
    },
    {
      "atomId": "LLM_APPLICATION_ENGINEERING",
      "version": "1.0.0",
      "name": "LLM 应用工程",
      "description": "结构化输出、Prompt Injection 防御、BYOK、Token 与降级治理",
      "capabilityDomain": "LLM_ENGINEERING",
      "jobTracks": ["AI_RAG_AGENT"],
      "parentAtomId": null
    },
    {
      "atomId": "AI_APPLICATION_RELIABILITY",
      "version": "1.0.0",
      "name": "AI 应用可靠性",
      "description": "异步任务、外部模型超时、幂等、补偿、审计与隐私保护",
      "capabilityDomain": "RELIABILITY",
      "jobTracks": ["AI_RAG_AGENT"],
      "parentAtomId": null
    }
  ],
  "templates": [
    {
      "templateCode": "JAVA_BACKEND_BASELINE",
      "jobTrack": "JAVA_BACKEND",
      "version": "1.0.0",
      "status": "PUBLISHED",
      "capabilities": [
        {"atomId": "JAVA_LANGUAGE_FOUNDATION", "atomVersion": "1.0.0", "defaultWeight": 0.14, "minimumCoverage": 1, "questionTypes": ["CONCEPT", "SCENARIO"]},
        {"atomId": "SPRING_APPLICATION", "atomVersion": "1.0.0", "defaultWeight": 0.17, "minimumCoverage": 1, "questionTypes": ["CONCEPT", "PROJECT"]},
        {"atomId": "DATABASE_TRANSACTION", "atomVersion": "1.0.0", "defaultWeight": 0.16, "minimumCoverage": 1, "questionTypes": ["CONCEPT", "SCENARIO"]},
        {"atomId": "CACHE_DISTRIBUTED", "atomVersion": "1.0.0", "defaultWeight": 0.13, "minimumCoverage": 1, "questionTypes": ["SCENARIO"]},
        {"atomId": "MESSAGE_RELIABILITY", "atomVersion": "1.0.0", "defaultWeight": 0.12, "minimumCoverage": 1, "questionTypes": ["SCENARIO", "PROJECT"]},
        {"atomId": "BACKEND_SYSTEM_DESIGN", "atomVersion": "1.0.0", "defaultWeight": 0.15, "minimumCoverage": 1, "questionTypes": ["SYSTEM_DESIGN"]},
        {"atomId": "PROJECT_TROUBLESHOOTING", "atomVersion": "1.0.0", "defaultWeight": 0.13, "minimumCoverage": 1, "questionTypes": ["PROJECT", "TROUBLESHOOTING"]}
      ]
    },
    {
      "templateCode": "AI_RAG_AGENT_BASELINE",
      "jobTrack": "AI_RAG_AGENT",
      "version": "1.0.0",
      "status": "PUBLISHED",
      "capabilities": [
        {"atomId": "RAG_DOCUMENT_PIPELINE", "atomVersion": "1.0.0", "defaultWeight": 0.15, "minimumCoverage": 1, "questionTypes": ["CONCEPT", "PROJECT"]},
        {"atomId": "RAG_RETRIEVAL", "atomVersion": "1.0.0", "defaultWeight": 0.19, "minimumCoverage": 1, "questionTypes": ["CONCEPT", "SCENARIO"]},
        {"atomId": "RAG_EVALUATION", "atomVersion": "1.0.0", "defaultWeight": 0.13, "minimumCoverage": 1, "questionTypes": ["PROJECT", "SCENARIO"]},
        {"atomId": "AGENT_ORCHESTRATION", "atomVersion": "1.0.0", "defaultWeight": 0.17, "minimumCoverage": 1, "questionTypes": ["PROJECT", "SYSTEM_DESIGN"]},
        {"atomId": "LLM_APPLICATION_ENGINEERING", "atomVersion": "1.0.0", "defaultWeight": 0.12, "minimumCoverage": 1, "questionTypes": ["SCENARIO"]},
        {"atomId": "AI_APPLICATION_RELIABILITY", "atomVersion": "1.0.0", "defaultWeight": 0.10, "minimumCoverage": 1, "questionTypes": ["TROUBLESHOOTING", "SYSTEM_DESIGN"]},
        {"atomId": "MESSAGE_RELIABILITY", "atomVersion": "1.0.0", "defaultWeight": 0.06, "minimumCoverage": 0, "questionTypes": ["SCENARIO"]},
        {"atomId": "BACKEND_SYSTEM_DESIGN", "atomVersion": "1.0.0", "defaultWeight": 0.04, "minimumCoverage": 0, "questionTypes": ["SYSTEM_DESIGN"]},
        {"atomId": "PROJECT_TROUBLESHOOTING", "atomVersion": "1.0.0", "defaultWeight": 0.04, "minimumCoverage": 1, "questionTypes": ["PROJECT"]}
      ]
    }
  ],
  "questionTemplates": [
    {"questionCode": "JAVA_LANGUAGE_SCENARIO", "version": "1.0.0", "status": "PUBLISHED", "atomId": "JAVA_LANGUAGE_FOUNDATION", "atomVersion": "1.0.0", "difficulty": "MEDIUM", "stage": "POSITION_TECH", "promptSkeleton": "给出一个与目标岗位相关的 Java 并发或语言语义场景，要求候选人说明行为、边界与验证方式。", "rubricCode": "TECHNICAL_ANSWER", "rubricVersion": "1.0.0"},
    {"questionCode": "SPRING_PROJECT_DEEP_DIVE", "version": "1.0.0", "status": "PUBLISHED", "atomId": "SPRING_APPLICATION", "atomVersion": "1.0.0", "difficulty": "MEDIUM", "stage": "PROJECT_DEEP_DIVE", "promptSkeleton": "结合候选人项目证据，追问一个 Spring 调用链、事务或 AOP 设计，并要求说明失效路径。", "rubricCode": "TECHNICAL_ANSWER", "rubricVersion": "1.0.0"},
    {"questionCode": "DATABASE_CONSISTENCY_SCENARIO", "version": "1.0.0", "status": "PUBLISHED", "atomId": "DATABASE_TRANSACTION", "atomVersion": "1.0.0", "difficulty": "MEDIUM", "stage": "POSITION_TECH", "promptSkeleton": "构造一个事务、索引或并发写入场景，要求候选人从 SQL、锁和业务一致性三个层面分析。", "rubricCode": "TECHNICAL_ANSWER", "rubricVersion": "1.0.0"},
    {"questionCode": "CACHE_FAILURE_SCENARIO", "version": "1.0.0", "status": "PUBLISHED", "atomId": "CACHE_DISTRIBUTED", "atomVersion": "1.0.0", "difficulty": "MEDIUM", "stage": "ENGINEERING_SCENARIO", "promptSkeleton": "给出缓存一致性或分布式锁故障，要求说明时序、失效条件、降级和监控证据。", "rubricCode": "TECHNICAL_ANSWER", "rubricVersion": "1.0.0"},
    {"questionCode": "MQ_RELIABILITY_SCENARIO", "version": "1.0.0", "status": "PUBLISHED", "atomId": "MESSAGE_RELIABILITY", "atomVersion": "1.0.0", "difficulty": "MEDIUM", "stage": "ENGINEERING_SCENARIO", "promptSkeleton": "给出消息重复、丢失或乱序场景，要求候选人设计生产、消费、重试和补偿链路。", "rubricCode": "TECHNICAL_ANSWER", "rubricVersion": "1.0.0"},
    {"questionCode": "BACKEND_SYSTEM_DESIGN", "version": "1.0.0", "status": "PUBLISHED", "atomId": "BACKEND_SYSTEM_DESIGN", "atomVersion": "1.0.0", "difficulty": "HARD", "stage": "ENGINEERING_SCENARIO", "promptSkeleton": "根据 JD 的业务约束提出一个小型系统设计题，要求覆盖接口、数据、可靠性、安全与可观测性。", "rubricCode": "TECHNICAL_ANSWER", "rubricVersion": "1.0.0"},
    {"questionCode": "PROJECT_INCIDENT_DEEP_DIVE", "version": "1.0.0", "status": "PUBLISHED", "atomId": "PROJECT_TROUBLESHOOTING", "atomVersion": "1.0.0", "difficulty": "MEDIUM", "stage": "PROJECT_DEEP_DIVE", "promptSkeleton": "从简历或代码证据选择一个真实模块，追问调用链、关键取舍、故障证据和验证方式；证据不足时使用中性问题。", "rubricCode": "TECHNICAL_ANSWER", "rubricVersion": "1.0.0"},
    {"questionCode": "RAG_PIPELINE_DEEP_DIVE", "version": "1.0.0", "status": "PUBLISHED", "atomId": "RAG_DOCUMENT_PIPELINE", "atomVersion": "1.0.0", "difficulty": "MEDIUM", "stage": "PROJECT_DEEP_DIVE", "promptSkeleton": "结合项目证据追问文档从上传到可检索的状态变化、一致性与失败恢复。", "rubricCode": "TECHNICAL_ANSWER", "rubricVersion": "1.0.0"},
    {"questionCode": "RAG_RETRIEVAL_DESIGN", "version": "1.0.0", "status": "PUBLISHED", "atomId": "RAG_RETRIEVAL", "atomVersion": "1.0.0", "difficulty": "HARD", "stage": "POSITION_TECH", "promptSkeleton": "给出复杂查询，要求候选人设计分域召回、融合、重排、证据不足和冲突处理。", "rubricCode": "TECHNICAL_ANSWER", "rubricVersion": "1.0.0"},
    {"questionCode": "RAG_EVALUATION_EXPERIMENT", "version": "1.0.0", "status": "PUBLISHED", "atomId": "RAG_EVALUATION", "atomVersion": "1.0.0", "difficulty": "MEDIUM", "stage": "POSITION_TECH", "promptSkeleton": "要求候选人设计一个可复现的 RAG 对比实验，说明数据集、指标、坏例和结论边界。", "rubricCode": "TECHNICAL_ANSWER", "rubricVersion": "1.0.0"},